{
  "$schema": "https://json-schema.org/draft/2020-12/schema",
  "$id": "https://socioprophet.ai/contracts/execution-receipt.schema.json",
  "title": "ExecutionReceipt",
  "description": "Agent-execution envelope for the governed Executions Ledger. One ExecutionReceipt records a single agent run: the membrane ExecutionDecision that authorized it, the scoped capabilities it held vs. actually used, the verdict of its output, and the sealed proof artifact. It COMPOSES rather than duplicates: per-side-effect authorization stays in ActionReceipt (linked via action_receipt_ref), the autonomy axis reuses ScopedCapability.authority_band, and epistemic_level references SCOPE-D's proof-confidence axis. epistemic_level (proof confidence) and authority_band (autonomy ceiling) are DISTINCT axes and are deliberately not merged.",
  "type": "object",
  "additionalProperties": false,
  "required": [
    "schema_version",
    "execution_receipt_id",
    "agent",
    "input",
    "executed_at",
    "decision",
    "capabilities_held",
    "capabilities_used",
    "verdict",
    "proof_artifact",
    "receipt_hash"
  ],
  "properties": {
    "schema_version": { "type": "string", "const": "0.1.0" },
    "execution_receipt_id": { "type": "string", "pattern": "^exec_[a-z0-9][a-z0-9_.-]*$" },
    "agent": {
      "type": "object",
      "additionalProperties": false,
      "required": ["name", "version"],
      "properties": {
        "name": { "type": "string", "minLength": 1 },
        "version": { "type": "string", "minLength": 1 },
        "category": {
          "type": "string",
          "enum": ["investigation", "response", "email_security", "user_behavioral_analysis", "other"]
        }
      }
    },
    "input": {
      "type": "object",
      "additionalProperties": false,
      "required": ["type"],
      "properties": {
        "type": {
          "type": "string",
          "description": "The class of activity the agent was responding to.",
          "enum": ["external_alert", "reported_phish", "customization", "detection", "event"]
        },
        "ref": { "type": "string", "minLength": 1, "description": "Deep-link reference to the triggering item (e.g. an event or threat id)." }
      }
    },
    "executed_at": { "type": "string", "format": "date-time" },
    "decision": {
      "type": "object",
      "description": "The membrane ExecutionDecision that authorized this run. verdict reuses the ActionReceipt policy_decision vocabulary; authority_band reuses the ScopedCapability autonomy ladder.",
      "additionalProperties": false,
      "required": ["verdict", "authority_band"],
      "properties": {
        "verdict": {
          "type": "string",
          "description": "Reuses ActionReceipt.policy_decision. require_approval is the APPROVAL_REQUIRED state.",
          "enum": ["allow", "block", "require_approval", "degrade", "transform"]
        },
        "policy_id": { "type": "string" },
        "authority_band": {
          "type": "string",
          "description": "Autonomy ceiling exercised for this run. Reuses ScopedCapability.authority_band. This is the L0..L5 autonomy axis and is NOT epistemic_level.",
          "enum": ["observe", "recommend", "queue", "execute_local", "execute_remote", "admin_override"]
        },
        "latency_ms": { "type": "number", "minimum": 0 }
      }
    },
    "capabilities_held": {
      "type": "array",
      "description": "ScopedCapability ids the agent held for this run (cap_ refs).",
      "items": { "type": "string", "pattern": "^cap_[a-z0-9][a-z0-9_.-]*$" },
      "uniqueItems": true
    },
    "capabilities_used": {
      "type": "array",
      "description": "Subset of capabilities_held actually exercised. Must be a subset of capabilities_held (enforced by the validator, not the schema).",
      "items": { "type": "string", "pattern": "^cap_[a-z0-9][a-z0-9_.-]*$" },
      "uniqueItems": true
    },
    "verdict": {
      "type": "object",
      "description": "The verdict of the agent's output. state is the ledger's own settled/held/refused axis; epistemic_level (optional) references SCOPE-D proof confidence and is a distinct axis from decision.authority_band.",
      "additionalProperties": false,
      "required": ["state"],
      "properties": {
        "state": {
          "type": "string",
          "enum": ["verified", "pending", "denied"]
        },
        "epistemic_level": {
          "type": "string",
          "description": "SCOPE-D proof-confidence axis (claim strength). NOT autonomy. Optional; present when a ProofArtifact carries a claim.",
          "enum": ["proved", "bounded", "empirical", "synthetic", "speculative", "rejected"]
        }
      }
    },
    "proof_artifact": {
      "type": "object",
      "description": "The sealed artifact that makes the verdict checkable. sha256/replayable reuse the ActionReceipt receipt-hash discipline; a bare boolean status is never sufficient.",
      "additionalProperties": false,
      "required": ["sha256", "replayable"],
      "properties": {
        "sha256": { "type": "string", "pattern": "^sha256:[a-z0-9_.-]+$" },
        "signed_by": { "type": "string", "minLength": 1 },
        "replayable": { "type": "boolean" }
      }
    },
    "action_receipt_ref": {
      "type": "string",
      "pattern": "^receipt_[a-z0-9][a-z0-9_.-]*$",
      "description": "Link to the ActionReceipt recording the per-side-effect authorization for this run. Present whenever the run produced a governed side effect."
    },
    "blast": {
      "type": "object",
      "description": "Link to the governed blast-radius (GBRG) reading for the resource this run touched. Populated by the containment engine.",
      "additionalProperties": false,
      "required": ["target_node", "reachable_count", "hops"],
      "properties": {
        "target_node": { "type": "string", "minLength": 1 },
        "reachable_count": { "type": "integer", "minimum": 0 },
        "hops": { "type": "integer", "minimum": 0 },
        "containment_proof_ref": { "type": "string", "pattern": "^sha256:[a-z0-9_.-]+$" }
      }
    },
    "created_at": { "type": "string", "format": "date-time" },
    "receipt_hash": { "type": "string", "pattern": "^sha256:[a-z0-9_.-]+$" },
    "previous_receipt_hash": { "type": "string", "pattern": "^sha256:[a-z0-9_.-]+$" },
    "metadata": { "type": "object", "additionalProperties": true }
  }
}
