{
  "schema_version": "0.1.0",
  "execution_receipt_id": "exec_threat_response_recommendation_pending_demo",
  "agent": {
    "name": "Threat Response Recommendation Agent",
    "version": "1.2.0",
    "category": "response"
  },
  "input": {
    "type": "detection",
    "ref": "threat_591"
  },
  "executed_at": "2026-07-31T15:08:48Z",
  "decision": {
    "verdict": "require_approval",
    "policy_id": "policy_warrant_v4",
    "authority_band": "queue",
    "latency_ms": 41
  },
  "capabilities_held": [
    "cap_read_detections_demo",
    "cap_isolate_endpoint_demo"
  ],
  "capabilities_used": [
    "cap_read_detections_demo"
  ],
  "verdict": {
    "state": "pending"
  },
  "proof_artifact": {
    "sha256": "sha256:7c025b1e0a1b2c3d4e5f60718293a4b5c6d7e8f90a1b2c3d4e5f6071829a3b4c5",
    "signed_by": "warden",
    "replayable": true
  },
  "blast": {
    "target_node": "endpoint://vvv-648e9d56f1a",
    "reachable_count": 14,
    "hops": 5,
    "containment_proof_ref": "sha256:containment-vvv-648e9d56f1a-full-demo"
  },
  "created_at": "2026-07-31T15:08:49Z",
  "receipt_hash": "sha256:exec-threat-response-recommendation-pending-demo"
}
