{
  "schema_version": "0.1.0",
  "execution_receipt_id": "exec_investigation_agent_denied_demo",
  "agent": {
    "name": "Investigation Agent",
    "version": "1.0.2",
    "category": "investigation"
  },
  "input": {
    "type": "event",
    "ref": "event_16517"
  },
  "executed_at": "2026-07-31T13:38:49Z",
  "decision": {
    "verdict": "block",
    "policy_id": "policy_warrant_v4",
    "authority_band": "observe",
    "latency_ms": 8
  },
  "capabilities_held": [
    "cap_read_events_demo"
  ],
  "capabilities_used": [],
  "verdict": {
    "state": "denied",
    "epistemic_level": "rejected"
  },
  "proof_artifact": {
    "sha256": "sha256:a0f12277b3c4d5e6f7a8b9c0d1e2f3a4b5c6d7e8f9a0b1c2d3e4f5a6b7c8d9e0f",
    "signed_by": "warden",
    "replayable": true
  },
  "created_at": "2026-07-31T13:38:50Z",
  "receipt_hash": "sha256:exec-investigation-agent-denied-demo",
  "previous_receipt_hash": "sha256:exec-hybrid-investigation-wiz-verified-demo"
}
